location,line,role,message
/TEI[1],,error,"The xml:id of the TEI element should be equal to the name of the file, without the file extension. Currently the value of xml:id is ""st_0000000001"" whilst the file name is ""step_Trcttu.xml"""
/TEI[1]/teiHeader[1]/revisionDesc[1]/change[1],33,information,"When recording a revision, some precise metadata must be given : the date of the revision, the name of the responsibe and his/her affiliation and a description."
/TEI[1]/text[1]/body[1]/listEvent[1]/event[1]/head[1],41,error,The title is too long: 100 characters maximum
/TEI[1]/text[1]/body[1]/listEvent[1]/event[1]/linkGrp[1]/ref[1],53,information,"It is possible to add terms to resources, for instance a standard or a technique."
/TEI[1]/teiHeader[1]/fileDesc[1]/titleStmt[1],7,warning,The main sponsor of the SSK is the PARTHENOS project. All scenarios and steps should record this information.
/TEI[1]/teiHeader[1]/fileDesc[1]/sourceDesc[1],27,information,"sourceDesc in mandatory in TEI, so if you want to give details on the way the scenario was conceived, it is the appropriate location."
