context,test,location,line,tag,nodeText,message
tei:TEI,"string(.) = substring-before($fileName, '.xml')",/TEI[1],,,,"The xml:id of the TEI element should be equal to the name of the file, without the file extension. Currently the value of xml:id is ""SSK_sc_corpusModellingInTEI-minusDigitization"" whilst the file name is ""SSK_sc_corpusModellingInTEI-minusDigitization.xml"""
tei:TEI,string(.) = 'researchScenario' or . = 'researchStep',/TEI[1],,,,"TEI/@type should be either ""researchScenario"" or ""researchStep"". The current value of TEI/@type is ""researchScenario"""
tei:change,tei:date and tei:persName and tei:affiliation and tei:desc,/TEI[1]/teiHeader[1]/revisionDesc[1]/change[1],59,{http://www.tei-c.org/ns/1.0}change,,"When recording a revision, some precise metadata must be given : the date of the revision, the name of the responsibe and his/her affiliation and a description."
tei:desc[@type = 'definition'],tei:list or tei:ref,/TEI[1]/text[1]/body[1]/div[1]/desc[1],66,{http://www.tei-c.org/ns/1.0}desc,"This scenario explains the steps to take, in order to
     create a corpus based on the TEI tagset. As of today, the TEI guidelines have become a de facto
     standard for text annotation, providing solutions for a great variety of text and phrase
     structures, information on content types, linguistic information on words or phrases, etc. In
     many digital text collections and digital edition projects annotation has been based on the
     TEI. Linguistic corpora based on TEI may thus be re-used in projects of other disciplines as
     well or may themselves benefit from the wide range of already existing resources.","In the <desc type=""definition>, there should be nothing more than text, <list> and <ref>."
tei:sourceDesc,child::*,/TEI[1]/teiHeader[1]/fileDesc[1]/sourceDesc[1],32,{http://www.tei-c.org/ns/1.0}sourceDesc,"
            ","sourceDesc in mandatory in TEI, so if you want to give details on the way the scenario was conceived, it is the appropriate location."
tei:div/tei:head,normalize-space(.),/TEI[1]/text[1]/body[1]/div[1]/head[1],65,{http://www.tei-c.org/ns/1.0}head,Creation of a TEI-based corpus,The title of a scenario should describe the main goal of the scenario.
tei:desc[@type = 'terms'],ancestor::tei:TEI[@type = 'researchScenario'] and count(tei:term[@type = 'standard']) = 0,/TEI[1]/text[1]/body[1]/div[1]/desc[2],73,{http://www.tei-c.org/ns/1.0}desc,"
               ",A scenario could have several keywords related to standards. Check the documentation for more details
tei:desc[@type = 'terms'],ancestor::tei:TEI[@type = 'researchScenario'] and count(tei:term[@type = 'technique']) = 0,/TEI[1]/text[1]/body[1]/div[1]/desc[2],73,{http://www.tei-c.org/ns/1.0}desc,"
               ",A scenario could have several keywords related to research techniques. Check the Tadirah taxonomy for more details.
tei:desc[@type = 'terms'],ancestor::tei:TEI[@type = 'researchScenario'] and count(tei:term[@type = 'object']) = 0,/TEI[1]/text[1]/body[1]/div[1]/desc[2],73,{http://www.tei-c.org/ns/1.0}desc,"
               ",A scenario could have several keywords related to research objects. Check the Tadirah taxonomy for more details.
